{
  "$schema": "./schemas/state.schema.json",
  "schema_version": "1.0.0",
  "lifecycle": ["QUEUED", "ASSIGNED", "IMPLEMENTING", "READY_FOR_TEST", "TESTING", "READY_FOR_VALIDATION", "VALIDATING", "PASSED", "READY_FOR_MERGE", "COMPLETED", "TEST_FAILED", "VALIDATION_FAILED", "BLOCKED", "CANCELLED"],
  "current_state": "QUEUED",
  "current_branch": "abos-factory/v1",
  "authoritative_goal_tracker": "factory/state.json",
  "milestone_reference": "src/lib/milestones.js",
  "last_inspection_report": ".branch-factory/reports/repository-inspection.json",
  "active_task_id": null,
  "merge_gate": {
    "auto_merge_allowed": false,
    "protected_branch_merge_allowed": false,
    "requires_independent_tester": true,
    "requires_independent_validator": true,
    "requires_no_unrelated_files": true,
    "requires_no_new_secrets": true
  },
  "evidence": {
    "repository_inspected": true,
    "inspection_report": ".branch-factory/reports/repository-inspection.json",
    "created_by_task": "SPRINT0-BRANCH-FACTORY"
  }
}
